{"aggregates":{"cycle_time_hours":{"n":4,"p50":60.0,"p75":72.0,"p90":72.0},"throughput":5},"meta":{"caller":"test-account-alpha","generated_at":"__GENERATED_AT__","issuetype_config_sha":"d5b94b42f16cdece55f8344aaddf272b1b671af7a231c2304ce1e94490ffcc02","metrics_requested":["cycle_time","throughput"],"per_team_double_counted":false,"schema_version":"1.0","scope":{"project":"ALPHA"},"sources":["jira"],"state_config_sha":"3f51f53200e2ab5a14dcda40f08d80e8bbfa5a9de8457b7c24f784c06aa781b8","window":{"from":"2026-01-01","to":"2026-01-07"}},"notes":["1 delivered without commitment-state entry; excluded from cycle_time.","1 issues cancelled in window; excluded from throughput, cycle_time, lead_time, flow_efficiency, and flow_distribution.","defect_ratio is not Change Failure Rate; see spec §Out of scope.","defect_ratio uses flow_distribution denominator; throughput excludes subtasks (override: --include-subtasks).","flow_load: 7 samples, weekends included."],"per_team":[{"aggregates":{"cycle_time_hours":{"n":1,"p50":null,"p75":null,"p90":null},"throughput":2},"team":"Bar"},{"aggregates":{"cycle_time_hours":{"n":3,"p50":48.0,"p75":72.0,"p90":86.4},"throughput":3},"team":"Foo"}]}
