{"aggregates":{"cycle_time_hours":{"n":3,"p50":72.0,"p75":72.0,"p90":72.0},"defect_ratio":0.3333,"flow_distribution":{"feature":0.6667,"defect":0.3333,"debt":0.0,"risk":0.0,"subtask":0.0,"other":0.0,"denominator":3},"flow_efficiency":{"n":3,"p50":1.0,"p75":1.0,"p90":1.0},"flow_load":1.0,"flow_time_hours":{"n":3,"p50":121.0,"p75":122.0,"p90":122.6},"lead_time_hours":{"n":3,"p50":121.0,"p75":122.0,"p90":122.6},"rework_rate":0.0,"throughput":3,"wip":1},"meta":{"caller":"test-account-program","generated_at":"__GENERATED_AT__","issuetype_config_sha":"d5b94b42f16cdece55f8344aaddf272b1b671af7a231c2304ce1e94490ffcc02","metrics_requested":["cycle_time","lead_time","throughput","wip","flow_load","rework_rate","flow_time","flow_efficiency","flow_distribution","defect_ratio"],"per_team_double_counted":true,"schema_version":"1.0","scope":{"program_id":"42"},"sources":["jira","jira-align"],"state_config_sha":"beaaf4ae679ffa2223dbefba1edaf06016c9f36e7dfc8aa36efa7e459986efeb","window":{"from":"2026-01-01","to":"2026-01-07"}},"notes":["defect_ratio is not Change Failure Rate; see spec §Out of scope.","defect_ratio uses flow_distribution denominator; throughput excludes subtasks (override: --include-subtasks).","flow_load: 7 samples, weekends included.","per_team: 0 issues belong to multiple teams and are counted in each team's row.","per_team: 1 issues had no readable team_field value; bucketed as '(no team)'."],"per_team":[{"aggregates":{"cycle_time_hours":{"n":1,"p50":null,"p75":null,"p90":null},"defect_ratio":0.0,"flow_distribution":{"feature":1.0,"defect":0.0,"debt":0.0,"risk":0.0,"subtask":0.0,"other":0.0,"denominator":1},"flow_efficiency":{"n":1,"p50":null,"p75":null,"p90":null},"flow_load":0.0,"flow_time_hours":{"n":1,"p50":null,"p75":null,"p90":null},"lead_time_hours":{"n":1,"p50":null,"p75":null,"p90":null},"rework_rate":0.0,"throughput":1,"wip":0},"team":"(no team)"},{"aggregates":{"cycle_time_hours":{"n":1,"p50":null,"p75":null,"p90":null},"defect_ratio":0.0,"flow_distribution":{"feature":1.0,"defect":0.0,"debt":0.0,"risk":0.0,"subtask":0.0,"other":0.0,"denominator":1},"flow_efficiency":{"n":1,"p50":null,"p75":null,"p90":null},"flow_load":1.0,"flow_time_hours":{"n":1,"p50":null,"p75":null,"p90":null},"lead_time_hours":{"n":1,"p50":null,"p75":null,"p90":null},"rework_rate":0.0,"throughput":1,"wip":1},"team":"Alpha"},{"aggregates":{"cycle_time_hours":{"n":1,"p50":null,"p75":null,"p90":null},"defect_ratio":1.0,"flow_distribution":{"feature":0.0,"defect":1.0,"debt":0.0,"risk":0.0,"subtask":0.0,"other":0.0,"denominator":1},"flow_efficiency":{"n":1,"p50":null,"p75":null,"p90":null},"flow_load":0.0,"flow_time_hours":{"n":1,"p50":null,"p75":null,"p90":null},"lead_time_hours":{"n":1,"p50":null,"p75":null,"p90":null},"rework_rate":0.0,"throughput":1,"wip":0},"team":"Beta"}]}
