{"aggregates":{"cycle_time_hours":{"n":4,"p50":60.0,"p75":72.0,"p90":72.0},"defect_ratio":0.4,"flow_distribution":{"feature":0.6,"defect":0.4,"debt":0.0,"risk":0.0,"subtask":0.0,"other":0.0,"denominator":5},"flow_efficiency":{"n":4,"p50":0.9688,"p75":1.0,"p90":1.0},"flow_load":1.2857,"flow_time_hours":{"n":5,"p50":121.0,"p75":133.0,"p90":152.8},"lead_time_hours":{"n":5,"p50":121.0,"p75":133.0,"p90":152.8},"rework_rate":0.2,"throughput":5,"wip":1},"cohort_breakdown":{"cohort":{"cycle_time_hours":{"n":3,"p50":48.0,"p75":72.0,"p90":86.4},"defect_ratio":0.3333,"flow_distribution":{"feature":0.6667,"defect":0.3333,"debt":0.0,"risk":0.0,"subtask":0.0,"other":0.0,"denominator":3},"flow_efficiency":{"n":3,"p50":1.0,"p75":1.0,"p90":1.0},"flow_load":0.0,"flow_time_hours":{"n":3,"p50":121.0,"p75":144.0,"p90":157.8},"lead_time_hours":{"n":3,"p50":121.0,"p75":144.0,"p90":157.8},"rework_rate":0.3333,"throughput":3,"wip":0},"control":{"cycle_time_hours":{"n":1,"p50":null,"p75":null,"p90":null},"defect_ratio":0.5,"flow_distribution":{"feature":0.5,"defect":0.5,"debt":0.0,"risk":0.0,"subtask":0.0,"other":0.0,"denominator":2},"flow_efficiency":{"n":1,"p50":null,"p75":null,"p90":null},"flow_load":1.2857,"flow_time_hours":{"n":2,"p50":73.0,"p75":146.5,"p90":190.6},"lead_time_hours":{"n":2,"p50":73.0,"p75":146.5,"p90":190.6},"rework_rate":0.0,"throughput":2,"wip":1}},"meta":{"caller":"test-account-alpha","cohort_jql":"labels = ai-assisted","generated_at":"__GENERATED_AT__","issuetype_config_sha":"d5b94b42f16cdece55f8344aaddf272b1b671af7a231c2304ce1e94490ffcc02","metrics_requested":["cycle_time","lead_time","throughput","wip","flow_load","rework_rate","flow_time","flow_efficiency","flow_distribution","defect_ratio"],"per_team_double_counted":false,"schema_version":"1.0","scope":{"project":"ALPHA"},"sources":["jira"],"state_config_sha":"3f51f53200e2ab5a14dcda40f08d80e8bbfa5a9de8457b7c24f784c06aa781b8","window":{"from":"2026-01-01","to":"2026-01-07"}},"notes":["1 delivered without commitment-state entry; excluded from cycle_time.","1 issues cancelled in window; excluded from throughput, cycle_time, lead_time, flow_efficiency, and flow_distribution.","defect_ratio is not Change Failure Rate; see spec §Out of scope.","defect_ratio uses flow_distribution denominator; throughput excludes subtasks (override: --include-subtasks).","flow_load: 7 samples, weekends included."],"per_team":[{"aggregates":{"cycle_time_hours":{"n":1,"p50":null,"p75":null,"p90":null},"defect_ratio":0.5,"flow_distribution":{"feature":0.5,"defect":0.5,"debt":0.0,"risk":0.0,"subtask":0.0,"other":0.0,"denominator":2},"flow_efficiency":{"n":1,"p50":null,"p75":null,"p90":null},"flow_load":0.2857,"flow_time_hours":{"n":2,"p50":73.0,"p75":146.5,"p90":190.6},"lead_time_hours":{"n":2,"p50":73.0,"p75":146.5,"p90":190.6},"rework_rate":0.0,"throughput":2,"wip":0},"team":"Bar"},{"aggregates":{"cycle_time_hours":{"n":3,"p50":48.0,"p75":72.0,"p90":86.4},"defect_ratio":0.3333,"flow_distribution":{"feature":0.6667,"defect":0.3333,"debt":0.0,"risk":0.0,"subtask":0.0,"other":0.0,"denominator":3},"flow_efficiency":{"n":3,"p50":1.0,"p75":1.0,"p90":1.0},"flow_load":1.0,"flow_time_hours":{"n":3,"p50":121.0,"p75":144.0,"p90":157.8},"lead_time_hours":{"n":3,"p50":121.0,"p75":144.0,"p90":157.8},"rework_rate":0.3333,"throughput":3,"wip":1},"team":"Foo"}]}
